id,title,role,date,content,skills,bearing,longitude,latitude,zoom,pitch,speed,link,link_alias,url_img,border_color,bg_size
0,Bonjour !,Géomaticien basé sur Nantes.,,"J'administre un SGBD spatial, automatise les traitements, et gère un portail web-cartographique.",PostgreSQL ; Python ; GeoServer ; Qgis ; Gdal/Ogr ; Vmap ; Maplibre ; Flask,0,-1.553603493340308,47.218599718064844,16,60,1.3,,,/static/img/moi.png,#C84D82,120%
1,Abei Energy,Chargé d'études SIG (cdi - poste actuel),02|2023 - Présent,> Automatisation du traitement de données  ; > Développement et maintenance du webSIG de l'entreprise,PostgreSQL ; Python ; GeoServer ; Qgis ; Gdal/Ogr ; Vmap ; Git ; Docker,20,-3.6914852859185343,40.42880022606314,16,20,1.6,https://abeienergy.fr/,Abei Energy,/static/img/abei.png,#F4A261,80%
2,Thema Environnement,Géomaticien (cdd - 6 mois),05|2022 - 11|2022,">Production cartographique et infographique ; > Traitement de données, Analyses spatiales, Atlas et cartographies",PostgreSQL; Qgis ; Arcgis ; Gdal; Adobe Illustrator,0,-1.1857005797117022,47.40885995562285,16,40,1.6,https://www.thema-environnement.fr/,Thema Environnement,/static/img/thema.png,#37A77B,80%
3,GIP Littoral,Chargé d'études SIG (cdd - 6 mois & stage - 6 mois),03|2021 - 04|2022,"> Méthodologie SIG, Rapport sur la sensibilité à l'érosion du littoral Aquitain; > Traitement de données, Analyses spatiales, Atlas et cartographies",PostgreSQL; Qgis ; Gdal; Adobe Illustrator,10,-0.5513001527871958,44.82764741819648,16,60,1.6,https://www.giplittoral.fr/,Gip Littoral,/static/img/gip.png,#4575D4,90%
4,Université de Nantes,Master 2 - SIG & risques naturels,09|2016 - 09|2021,"> Traitement de données, Analyses spatiales, Atlas et cartographies; > Géographie et risques naturels",PostgreSQL; Python ; Qgis ; Adobe Illustrator,0,-1.5492718817522353,47.24614588519798,16,30,1.6,https://www.univ-nantes.fr/,Université de Nantes,/static/img/un.png,#87a7fa,80%
